Series #	Season #	Title	Notes	Original air date
4	1	"Robin Hood Play"	Alfie's school is performing the play Robin Hood and Alfie is chosen to play the part of Robin Hood. Alfie is excited at this prospect, but he does not want to wear tights because he feels that tights are for girls. However, he reconsiders his stance on tights when Dee Dee wisely tells him not to let that affect his performance as Robin Hood.	November 9, 1994
5	1	"Basketball Tryouts"	Alfie tries out for the basketball team and doesn't make it even after showing off his basketball skills. However, Harry, Dee Dee and Donnell make the team. Alfie is depressed and doesn't want to attend the celebration party. However, Goo sets him straight by telling him it was his own fault for not being a team player and kept the ball to himself.	November 30, 1994
6	1	"Where's the Snake?"	Dee Dee gets a snake, but he doesn't want his parents to know about it. However, things get complicated when he loses the snake in the house. Meanwhile, Melanie and Deonne are assigned by their teacher to take care of her beloved pet rabbit, Duchess for the weekend. This causes both Alfie and Dee Dee to be concerned for Duchess when they learn from Goo that snakes eat rabbits.	December 6, 1994
7	1	"Dee Dee's Girlfriend"	A girl kisses Dee Dee in front of Harry and Donnell. They promise not to tell, but it slips and everyone laughs at Dee Dee. Dee Dee ends his friendship with Harry and Donnell and hangs out with Alfie and Goo. Soon, Alfie and Goo finally get the three to talk to each other.	December 15, 1994
8	1	"Dee Dee's Haircut"	Dee Dee wants to get a hair cut by Cool Doctor Money and have his name shaved in his head. His parents will not let him do this, but Goo offers to do it for five dollars. However, when Goo messes up Dee Dee's hair and spells his name wrong, his parents find out the truth and Dee Dee is forced to have his hair shaved off. In addition to that, his friends tease him about his bald head, causing a fight between the boys along with Goo and Alfie. In a b-story, Alfie and Goo try to play a practical joke on Dee Dee involving a jalapeño lollipop. It backfires when Roger is the unwitting victim and it leads to him chasing the boys around.	December 20, 1994
13	1	"The Big Bully"	Dee Dee gets beat up at school and his friends try to teach him how to fight back. Goo, however, tells him to bluff, but the plan backfires and Dee Dee gets hit because of it. When Alfie confronts the bully, he learns that Dee Dee was picked on by a girl. Alfie and Goo decide to confront her. However, when some of their classmates, who happen to be the girls' siblings, learn they are bullying their sister, they intervene.	February 2, 1995
